{
  "$schema": "../schemas/pwa-offline.schema.json",
  "schemaVersion": 2,
  "mode": "planning",
  "availability": "offline-capable",
  "serviceWorkerScope": "/",
  "controlledRouteIds": [
    "site-portal-home",
    "site-policy-composition-coexistence",
    "composition-overview",
    "composition-composition-concepts",
    "composition-evaluation-guide",
    "composition-consumer-guide",
    "site-composition-playground",
    "composition-release-guide",
    "composition-composer-reference",
    "composition-documentation-index",
    "composition-composition-model",
    "composition-catalog-architecture",
    "composition-generated-contract-manifest",
    "composition-composer-mvp",
    "composition-catalog-guide",
    "composition-schema-guide",
    "composition-publication-boundary",
    "composition-composition-authority-migration",
    "composition-skill-first-use-walkthrough",
    "composition-skill-overview",
    "composition-skill-contract",
    "composition-skill-documentation-index",
    "composition-skill-profiles",
    "composition-skill-capability-map",
    "composition-skill-architecture",
    "composition-website-webapp-selection",
    "composition-web-url-path-design-guidance",
    "composition-web-routes-v1-migration",
    "composition-web-routes-v2-migration",
    "composition-web-routes-v3-migration",
    "composition-website-product-walkthrough",
    "composition-webapp-product-walkthrough",
    "composition-webapp-overview",
    "composition-webapp-template",
    "composition-webapp-documentation-index",
    "composition-webapp-contracts",
    "composition-webapp-responsibility-boundaries",
    "composition-webapp-validation-toolchain",
    "composition-surfaces-v2-migration",
    "composition-ui-states-migration",
    "site-capabilities-overview",
    "composition-runtime-decision-record",
    "composition-runtime-selection",
    "composition-cli-interface",
    "composition-cli-interface-v2-migration",
    "composition-mcp-interface",
    "composition-mcp-transports",
    "composition-mcp-interface-v2-migration",
    "composition-mcp-apps-interface",
    "composition-mcp-apps-guidance",
    "composition-mcp-apps-v2-migration",
    "composition-browser-interface",
    "composition-pwa-capability",
    "composition-pwa-offline-v2-migration",
    "composition-pwa-update-v2-migration",
    "composition-web-interface-v2-migration",
    "composition-service-interface",
    "composition-service-interface-v2-migration",
    "site-lifecycle-overview",
    "composition-composition-state",
    "composition-contract-evolution",
    "composition-implementation-evidence",
    "composition-implementation-evidence-v2-migration",
    "composition-implementation-evidence-v3-migration",
    "composition-implementation-evidence-v4-migration",
    "composition-implementation-evidence-v5-migration",
    "composition-implementation-evidence-v6-migration",
    "composition-lifecycle-checkpoints",
    "composition-release-execution",
    "composition-release-execution-v2-migration",
    "composition-release-evidence",
    "composition-release-bundle",
    "policy-overview",
    "policy-provider-navigation",
    "policy-shared-policy-navigation",
    "policy-consumer-policy-navigation",
    "policy-getting-started",
    "policy-policy-concepts",
    "policy-managed-operation",
    "policy-cli",
    "policy-bootstrap",
    "policy-adoption",
    "policy-release-lifecycle",
    "policy-policy-readiness",
    "policy-documentation-publication",
    "policy-publication-catalog",
    "policy-pwa",
    "policy-google-ai-studio",
    "policy-repository-structure",
    "policy-architecture",
    "policy-configuration",
    "policy-policy-profiles",
    "policy-policy-authoring",
    "policy-policy-authority-inventory",
    "policy-review-policy",
    "policy-external-artifact-intake",
    "policy-regression-prevention",
    "policy-bootstrap-model",
    "policy-threat-model",
    "policy-adr-index",
    "policy-adr-repository-adoption",
    "policy-adr-application-neutral-scope",
    "policy-adr-single-policy-authority",
    "policy-adr-copyable-artifact-policy-adoption",
    "policy-adr-single-agent-policy-skill-runtime-cache",
    "policy-adr-integrated-bootstrap-skill"
  ],
  "navigationFallbackRouteId": "site-portal-home",
  "routePolicies": [
    {
      "routeId": "site-portal-home",
      "offlineReadBehavior": "cached-content-when-available"
    },
    {
      "routeId": "site-policy-composition-coexistence",
      "offlineReadBehavior": "cached-content-when-available"
    },
    {
      "routeId": "composition-overview",
      "offlineReadBehavior": "cached-content-when-available"
    },
    {
      "routeId": "composition-composition-concepts",
      "offlineReadBehavior": "cached-content-when-available"
    },
    {
      "routeId": "composition-evaluation-guide",
      "offlineReadBehavior": "cached-content-when-available"
    },
    {
      "routeId": "composition-consumer-guide",
      "offlineReadBehavior": "cached-content-when-available"
    },
    {
      "routeId": "site-composition-playground",
      "offlineReadBehavior": "cached-content-when-available"
    },
    {
      "routeId": "composition-release-guide",
      "offlineReadBehavior": "cached-content-when-available"
    },
    {
      "routeId": "composition-composer-reference",
      "offlineReadBehavior": "cached-content-when-available"
    },
    {
      "routeId": "composition-documentation-index",
      "offlineReadBehavior": "cached-content-when-available"
    },
    {
      "routeId": "composition-composition-model",
      "offlineReadBehavior": "cached-content-when-available"
    },
    {
      "routeId": "composition-catalog-architecture",
      "offlineReadBehavior": "cached-content-when-available"
    },
    {
      "routeId": "composition-generated-contract-manifest",
      "offlineReadBehavior": "cached-content-when-available"
    },
    {
      "routeId": "composition-composer-mvp",
      "offlineReadBehavior": "cached-content-when-available"
    },
    {
      "routeId": "composition-catalog-guide",
      "offlineReadBehavior": "cached-content-when-available"
    },
    {
      "routeId": "composition-schema-guide",
      "offlineReadBehavior": "cached-content-when-available"
    },
    {
      "routeId": "composition-publication-boundary",
      "offlineReadBehavior": "cached-content-when-available"
    },
    {
      "routeId": "composition-composition-authority-migration",
      "offlineReadBehavior": "cached-content-when-available"
    },
    {
      "routeId": "composition-skill-first-use-walkthrough",
      "offlineReadBehavior": "cached-content-when-available"
    },
    {
      "routeId": "composition-skill-overview",
      "offlineReadBehavior": "cached-content-when-available"
    },
    {
      "routeId": "composition-skill-contract",
      "offlineReadBehavior": "cached-content-when-available"
    },
    {
      "routeId": "composition-skill-documentation-index",
      "offlineReadBehavior": "cached-content-when-available"
    },
    {
      "routeId": "composition-skill-profiles",
      "offlineReadBehavior": "cached-content-when-available"
    },
    {
      "routeId": "composition-skill-capability-map",
      "offlineReadBehavior": "cached-content-when-available"
    },
    {
      "routeId": "composition-skill-architecture",
      "offlineReadBehavior": "cached-content-when-available"
    },
    {
      "routeId": "composition-website-webapp-selection",
      "offlineReadBehavior": "cached-content-when-available"
    },
    {
      "routeId": "composition-web-url-path-design-guidance",
      "offlineReadBehavior": "cached-content-when-available"
    },
    {
      "routeId": "composition-web-routes-v1-migration",
      "offlineReadBehavior": "cached-content-when-available"
    },
    {
      "routeId": "composition-web-routes-v2-migration",
      "offlineReadBehavior": "cached-content-when-available"
    },
    {
      "routeId": "composition-web-routes-v3-migration",
      "offlineReadBehavior": "cached-content-when-available"
    },
    {
      "routeId": "composition-website-product-walkthrough",
      "offlineReadBehavior": "cached-content-when-available"
    },
    {
      "routeId": "composition-webapp-product-walkthrough",
      "offlineReadBehavior": "cached-content-when-available"
    },
    {
      "routeId": "composition-webapp-overview",
      "offlineReadBehavior": "cached-content-when-available"
    },
    {
      "routeId": "composition-webapp-template",
      "offlineReadBehavior": "cached-content-when-available"
    },
    {
      "routeId": "composition-webapp-documentation-index",
      "offlineReadBehavior": "cached-content-when-available"
    },
    {
      "routeId": "composition-webapp-contracts",
      "offlineReadBehavior": "cached-content-when-available"
    },
    {
      "routeId": "composition-webapp-responsibility-boundaries",
      "offlineReadBehavior": "cached-content-when-available"
    },
    {
      "routeId": "composition-webapp-validation-toolchain",
      "offlineReadBehavior": "cached-content-when-available"
    },
    {
      "routeId": "composition-surfaces-v2-migration",
      "offlineReadBehavior": "cached-content-when-available"
    },
    {
      "routeId": "composition-ui-states-migration",
      "offlineReadBehavior": "cached-content-when-available"
    },
    {
      "routeId": "site-capabilities-overview",
      "offlineReadBehavior": "cached-content-when-available"
    },
    {
      "routeId": "composition-runtime-decision-record",
      "offlineReadBehavior": "cached-content-when-available"
    },
    {
      "routeId": "composition-runtime-selection",
      "offlineReadBehavior": "cached-content-when-available"
    },
    {
      "routeId": "composition-cli-interface",
      "offlineReadBehavior": "cached-content-when-available"
    },
    {
      "routeId": "composition-cli-interface-v2-migration",
      "offlineReadBehavior": "cached-content-when-available"